article_id,title,content,category
1,AI beats humans in chess,Artificial intelligence systems are now beating grandmasters in chess.,Technology
2,Stock markets hit record high,Global stock markets reached an all-time high due to tech growth.,Finance
3,Breakthrough in cancer research,Scientists discovered a new protein that may help fight cancer.,Health
4,Football World Cup highlights,The World Cup saw thrilling matches and unexpected results.,Sports
5,Climate change impacts agriculture,Climate change is reducing crop yields and affecting farmers worldwide.,Environment
6,SpaceX launches new rocket,SpaceX successfully launched its latest rocket into orbit.,Technology
7,Advances in quantum computing,Quantum computing is making strides with new algorithms.,Technology
8,New smartphone release,The latest smartphone model features advanced cameras and AI integration.,Technology
9,Global oil prices rise,Oil prices surged due to geopolitical tensions.,Finance
10,New vaccine approved,A new vaccine has been approved to combat seasonal flu.,Health
11,Olympics opening ceremony,The Olympics began with a spectacular opening ceremony.,Sports
12,Deforestation concerns grow,Deforestation rates are increasing in tropical regions.,Environment
13,AI in healthcare,AI is being used to improve diagnostics and patient care.,Technology
14,Bitcoin volatility continues,Bitcoin prices fluctuate amid regulatory uncertainty.,Finance
15,New diabetes treatment,Researchers developed a new drug for diabetes management.,Health
16,Cricket World Cup updates,Cricket fans witnessed exciting matches in the World Cup.,Sports
17,Pollution levels rise,Air pollution levels are rising in major cities.,Environment
18,Robotics in manufacturing,Robots are increasingly used in manufacturing industries.,Technology
19,Global recession fears,Economists warn of a potential global recession.,Finance
20,Heart disease breakthrough,A new therapy shows promise in reducing heart disease.,Health
21,Tennis Grand Slam results,Top players competed in the latest Grand Slam tournament.,Sports
22,Renewable energy adoption,Rising adoption of solar and wind energy worldwide.,Environment
23,AI in education,AI tools are transforming classrooms and personalized learning.,Technology
24,Stock market crash fears,Investors worry about a potential market crash.,Finance
25,Cancer survival rates improve,Survival rates improve with new treatments.,Health
26,Basketball championship results,The basketball championship concluded with a thrilling final.,Sports
27,Water scarcity issues,Water scarcity is affecting millions globally.,Environment
28,Machine learning in finance,Banks use machine learning for fraud detection.,Technology
29,Gold prices surge,Gold prices rise amid economic uncertainty.,Finance
30,New mental health therapy,A new therapy helps patients with depression.,Health
31,Hockey league updates,Hockey fans enjoyed intense league matches.,Sports
32,Wildlife conservation efforts,New efforts launched to protect endangered species.,Environment
33,AI in transportation,AI improves traffic management and autonomous vehicles.,Technology
34,Global trade tensions,Trade tensions rise between major economies.,Finance
35,New cancer drug trial,A new drug trial shows promising results.,Health
36,Marathon world record,A runner set a new marathon world record.,Sports
37,Ocean pollution crisis,Plastic pollution threatens marine ecosystems.,Environment
38,AI in retail,AI helps retailers personalize shopping experiences.,Technology
39,Interest rates rise,Central banks raise interest rates to curb inflation.,Finance
40,New Alzheimer’s treatment,Scientists test new treatment for Alzheimer’s disease.,Health
41,Baseball league highlights,Baseball fans witnessed exciting league games.,Sports
42,Global warming effects,Global warming is causing extreme weather events.,Environment
43,AI in agriculture,AI helps farmers improve crop yields.,Technology
44,Financial fraud cases rise,Financial fraud cases increase worldwide.,Finance
45,New vaccine research,Researchers work on vaccines for emerging diseases.,Health
46,Tennis doubles championship,The doubles championship saw surprising winners.,Sports
47,Forest fire concerns,Forest fires are increasing due to climate change.,Environment
48,AI in cybersecurity,AI strengthens defenses against cyberattacks.,Technology
49,Stock market recovery,Markets recover after recent downturn.,Finance
50,New surgical robot,A new surgical robot improves precision in operations.,Health